{
  "task_id": "task-example-clean-template",
  "work_id": "work-example-clean-template-spec",
  "from": "gamekit-feature-analyst",
  "to": "gamekit-qa-verifier",
  "summary": "Feature slice is ready for test design on the clean template example.",
  "artifacts": [
    ".claude-gamekit/project/docs/planning/features/example-clean-template.md"
  ],
  "open_risks": [],
  "next_action": "Generate the matching test cases."
}
